id,title,Category
CPeItiOqhQU,real racing 3 vs f1 mobile racing 2022  graphics comparison ,0
VuNIsY6JdUw,taylor swift  you belong with me ,0
90ysytCp6Wo,cosas que claramente no funcionan en minecraft ,0
bDacawxgXMg,i bought every seat in a movie theater to play fortnite ,0
FVlEaCrC3IM,why the average human couldn39t drive an f1 car  wired ,0
2DoJmgRzrr0,real racing 3 formula 1 race now ,0
XJvfBhSqJ24,king of sniperpubg mobile ,0
MFX0MggWdNc,idiot pilots in flight simulator x multiplayer chaos at st maarten ,0
y3X2SDiSTgQ,just a few buckets somehow michael jordan still made them special 19950401 ,0
uCuvwjffzOM,palazoo cinemas hack  1  forum nexus mall thatmadrasguys shorts ,0
K6WCcBP4lSs,the weeknd playboi carti madonna  popular official audio ,0
NsBesN5B_ik,m89 asian weightlifting championships 2023 ,0
5VOrnI3fOvI,new f2p kill record in world of tanks ,0
zjOddwR4nqw,taylor swift  end game ft ed sheeran amp future lyrics ,0
qxEgZb1dfnU,ronaldo  highest jump in football football soccer shorts ,0
7hX7uz7K4Tg,5 guitars you think are good but they39re not ,0
oYUdBUPAqhU,top 40 songs this week 2023  playlist music hits 2023 ,0
GN_bckt0_qs,wrong house  you die  minecraft   omocity  tagalog  ,0
Z-iLkokNA9A,i spent 100 days in red dead online here39s what happened ,0
b19k5EYPewk,best of unofficial rules of f1 ,0
ikmmcTwkaRE,voice actors demon slayeranime nezuko tanjiro zenitsu inosuke ,0
d2GpotsJZ8E,master your song using stock plugins in 60 sec logic pro x ,0
MYN6MxP68a8,the best spiderman game ever  spider man 2  part 2 ,0
no67aDqzT6Q,hip hop mix  snoop dogg ice cube pop smoke 2pac 5o cent dmx eazy e biggie dr dre nwa ,0
lP26UCnoH9s,coffee shop radio   247 lofi amp jazzy hiphop beats ,0
WIz1ygt2xZs,the anatomy of movement by muscle and motion shorts ,0
yJJFFduD3nE,canucks  predators 1024  nhl highlights 2023 ,0
uOK-063b640,squash  freeze cold  official music video ,0
L3I7t_4nUEU,best of pritam songs 2020  top 20 songs  pritam chakraborty audio jukebox hot ,0
I5lxwYmbVq8,first time anime watcher  attack on titan 4x14  39savagery39  reaction ,0
2eJv2TyKzzg,mclaren 765lt amp lamborghini huracn evo  forza horizon 5  thrustmaster t300rs gameplay ,0
W1LsRShUPtY,old time rock amp roll ,0
hRUBKbljc40,behind the scenes when ms dhoni told harsha bhogle that his quotanswerquot is ready ,0
MhbrAkMBa5g,logic  wake up feat lucy rose official music video ,0
OcB_fD737H8,if school taught video games 5 ,0
u919Qe1bVf4,where metro boomin got his other iconic producer tag  ,0
_ZZCmHupy0w,how everyone reacted to hulu ,0
ywtxjkaPm10,top 10 unscripted friends moments that were kept in the show ,0
7t-DGxG09l8,types of tissue part 3 muscle tissue ,0
hY2fa6Q98-k,the muscles song learn in 3 minutes ,0
vX3gaNc3xFc,this deck has a godly 99 win rate ,0
J7ml377pp7E,endgame the full multiverse war ,0
JKi86RCWAaw,rms titanic classic movie a night to remember 1958 ,0
UznjGzC5lKk,let39s play free fire on my new gaming laptop ,0
y9Nx-8Z5n6s,brandon figueroa usa vs mark magsayo philippines  boxing fight hd ,0
AFEbMrjBhF0,41 the truth about furina is found in childe  a genshin impact theory ,0
vE2_QJVhCac,gears 5  geforce now vs xbox cloud gaming  1080p 60 fps comparison ,0
S8piCHN602g,justin bieber  body rock beauty and a beat lyrics ft nicki minaj ,0
lLj1ofeRKTo,ms dhoni heartwinnig reaction on rashid khan holding indian flag after afghanistan won vs pak ,0
uJT4pbZNs00,tricked by my exwife  two and a half men  comedy central africa ,0
JAvwLm2-gEk,emoji beatbox challenge beatbox tiktok ,0
eUkUc0OwZhs,   league of legends             ,0
hUNAtr-xgyo,ms dhoni a tactical mastermind ,0
lFEKF-rDTTo,los angeles lakers vs denver nuggets full game highlights  october 24 2023  freedawkins ,0
7gmYkNE0wYw,the other black girl  official trailer  hulu ,0
pTryMmINtSM,family ronaldo 2017 vs family messi 2024  ronaldo messi georginarodriguez ,0
xM7BCDZx2aE,1 in a million moments in sports   4 ,0
6qNvQPXWFWQ,darth vaderanakin edit another love starwars edit ,0
MdLcP8dJls4,ariana grande39s skin care routine amp guide to a 60s cat eye  beauty secrets  vogue ,0
WGkJ4C_932Q,3 game android jadul yang bikin nostalgia part 10 ,0
slBgW46ptqU,how to dodge punches ,0
7Xf-Lesrkuc,train  drops of jupiter official video ,0
w8RAYw2Abnw,real racing 3  porsche 963 lmdh  update 117 ,0
OXaEUUUJJ7s,25 tennis shots so good the opponent had to applaud  ,0
C1MVh37u7XY,red dead redemption 2 4k 60fps  funny amp brutal moments vol 154 euphoria ragdolls ,0
gvZccmVDl9Y,barbie movie clip  just allan 2023 ,0
18L8LYcy_IY,4 footballers who made comeback after serious injuries  football soccer shorts ,0
bTo4NrSriWw,20 min full body workout intense routine no equipment ,0
GViX8riaHX4,30 min full body dumbbell workout at home  muscle building ,0
S51_bmqFXwM,step it up  top 10 dance songs  video jukebox  superhit dance video songs  tseries ,0
csxOgd0FuTY,lindsey raye ward  sia  chandelier drum cover ,0
SOA6wgzMdKM,the best 324 gaming pc ive ever built ,0
WsWPI18RmVU,what actually are muscle cramps ,0
Vj2N9Ea-ASs,king inertia  vs helium   grand beatbox battle 2021 world league  round of sixteen 18 ,0
QebVAG6l2ck,the worst chess game mathematically possible ,0
eAPxdmXX0K0,the russo brothers  imax cameras  avengers endgame ,0
ozuNiXuVPTk,peni parkers canon event comics spiderverse spiderman ,0
peopdf7VZA8,hogwarts legacy 10 things you didn39t know you could do ,0
MZa24fO8fy0,playing the most expensive tanks in world of tanks ,0
JdXubSf5YUc,juice wrld amp cordae  doomsday directed by cole bennett ,0
fv7ivRIlIPw,ben affleck39s the batman  full movie fanmade ,0
_ZMbmejhg8o,only 2 players can play this deck ,0
AX6OrbgS8lI,aur  tu hai kahan  raffey  usama  ahad official music video ,0
UR4M_FISILM,f1 live  usa gp race watchalong with commentary ,0
2-nkABqpV44,1200hp toyota supra  forza horizon 5  thrustmaster tx gameplay ,0
UEZpNwIbUK4,top 10 best mobile games of q2 2023 ,0
sdke9VennU0, new  j cop beatbox tiktok videos compilation 2023 ,0
YxJumUOGIPw,blockbuster until the bitter end commercial ,0
Og_4kLiBq4o,spiderman across the spiderverse breakdown  every marvel easter egg ,0
ABTdTTnnEU8,worlds largest explosion ,0
PDf9w4_S9xo,why oppenheimer39s bampw imax film is so special ,0
D08Us2V4-KQ,ridiculous pilot behavior in flight simulator x multiplayer atc ,0
7aUZtDaxS60,metro boomin aap rocky roisee  am i dreaming visualizer ,0
2M6v3KNpJQY,logic  flexicution official video ,0
TFrMDGfW_Sg,ariana grande  dangerous woman audio ,0
XSKaZQR__6w,22 rules you probably didn39t know about formula 1 ,0
L9LN6v5QurA,they thought i was hacking after this goal ,0
YaHlobTRr5c,movies that made the most money ever  shorts ,0
Mv4FMzvWkSc,franklin zengin oldu garaji araba doldu  gta 5 mods ,0
ISfQK_18jQg,taylor swift the eras tour movie  taylorswift erastour taylorswifterastour ,0
A8sxmkuGu7k,how players interact with fortnite npcs ,0
_ddXx7DuX5w,video games ,0
N-BlZOq8iTc,ufc 294 embedded   5 ,0
COqFP9reE4Y,the rolling stones  gimme shelter official visualizer ,0
RoE5DCsCzf4,marvel39s spiderman 2  triler de revelacin de juego ,0
kiD_4NBj66A,club day  hennessey venom f5  complete event walkthrough  real racing 3 ,0
aAAnWl-aO5g,samuel francesca michielin  cinema official video ,0
BgmVrguFO4o,teri jhuki nazar    murder 3  pritam shafqat amanat ali  aditi rao hydari  randeep hooda  4k ,0
CAD16_toMQ0,rushing enemy squad for revenge goes wrong  battlegrounds mobile india gameplay ,0
rkv1fpWLy0Q,how to lose fat and gain muscle at the same time 3 simple steps ,0
qRHEKcNoRts,a new glitch has been discovered in clash royale ,0
2QMhapWz70M,the witcher 3 the best game ive ever played ,0
OBuG-bsTcXY,top 10 mobile strategy games of 2023 new games revealed for android and ios ,0
B3ilnvULS00,coco gauff vs karolina muchova full match  2023 us open semifinal ,0
kdsEZlyB3io,logic  breath control ,0
6matQFr2W0s,ranking calisthenics exercises beginner to god ,0
dF9JXK34m3M,classic rock songs 70s 80s 90s full album  queen eagles pink floyd def leppard bon jovi ,0
FUzJJB8wLvQ,gear 5 luffy survives a direct impact  one piece ,0
RoxKbyst0To,10 best exercises to start calisthenics   beginner workout routine ,0
Hl19nxy7tLk,real racing 3 tips  how to ace every race ,0
_-FoaA6qwh4,how this street light qualified tfue to the world cup ,0
m4_9TFeMfJE,doja cat  paint the town red official video ,0
Zuu6ClXRabE,zoro defeats king  one piece ,0
BTdINEC_lTU,gta 5 karakterleri u an ne yapyor ,0
ZpA12AIvOGE,best of arijit singhs 2023  hindi romantic songs 2023  arijit singh hits songs   iztiraar lofi ,0
7jTYGqLQ4Tk,moose jaw 2023  usa v can  preliminary round   wpih championships apool ,0
JtHMApscLdc,rog gaming phone 6 unboxing shorts ,0
olcLBPCsATY,best perfectly cut minecraft clips of 2023 ,0
j0H4Nn_CoyM,golem just adapted to destroy the best players in clash royale ,0
L678M0y86dw,gta wanted level 100 ,0
lP6fC0KAcN0,day 9  evening session  paris 23 para athletics world championships ,0
35mf2_h_31k,witcher 3  7 quests most players hate ,0
SNNaBqZGF50,une nouvelle volution dbarque sur clash royale  ,0
5Nxw_fvo0u8,furious business  action movie 2023 full movie english action movies ,0
TPWWz0Oi_-Q,big smoke39s order shorts gta gtasanandreas grandtheftauto ,0
qNtoab4SsgQ,why messi doesnt run ,0
4vBOp8Fagyo,hogwarts legacy  before you buy ,0
TROhplo_1T8,winning the unwinnable world of tanks ,0
Bhrz1whq-zY,omarion  company official visualizer ,0
Uv1PyE8J38w,i met cristiano ronaldo ,0
hRezta6mdFI,despacito  luis fonsi daddy yankee ft justin bieber  electric guitar cover by kfir ochaion ,0
e9fvw5jPLjM,gamerpoop hogwarts legacy ,0
jmWmiQt24sU,i bought every xbox ever ,0
pfxyk1glEq4,chris brown  under the influence official video ,0
ZRhJT2nmvA4,marvel39s spiderman 2  gameplay reveal  ps5 games ,0
wBAhkdSsVOQ,how red bull avoided usgp error that got hamilton and leclerc excluded ,0
bXgCfj4VnTY,negotiating for the new daddy  two and a half men  comedy central africa ,0
G24Cv2WKAks,party mashup 2023  non stop party mashup  bollywood party songs 2023  hits party mashup song 2023 ,0
To4SWGZkEPk,tate mcrae  greedy official video ,0
0_7XPkBAxpo,juice wrld  cheese and dope freestyle ,0
_1TXqqOkvBY,top 30 flute covers of popular songs 2019 best instrumental flute cover all time ,0
QCcEJw2rbdQ,poco powerful gaming phone  poco f5 mrperfecttech ,0
AqJuVSu58oI,4 hours classical music for sleeping ,0
PfrMDVueQBI,batman police station escape scene   the batman 2022  clipit ,0
etsT3aG6Z0g,anthony sinisuka ginting vs weng hong yang  denmark open 2023 badminton ,0
HHbt6rPuC3M,star wars a vergence in the force episodes iiii fanedit ,0
3095_w_666w,top 40 cello covers of popular songs 2021  best instrumental cello covers songs all time ,0
OCunSKVKzdY,playing the most popular t9s in world of tanks ,0
UUEoxTm50wc,top 60 offline mobile games  ios and android ,0
x_m8OsBiATQ,top 20 newly released games of october 2023 for android amp ios  offline amp online  ,0
P3NxH0hMqos,ps4 vs xbox one    ,0
4NRXx6U8ABQ,the weeknd  blinding lights official video ,0
0fA8J1UyT6I,incredible hidden details in spiderman across the spiderverse part 3 ,0
rqQ1gJupDiw,should you play d3 sports in college ,0
Qu6S3_rrKGg,when f1 teams try to break the rules ,0
wzHekQTDegc,villains are not born they are made  the last summoner  sad story  anime shorts ,0
54Al9BpiYPw,labrinth  the feels official visualizer ,0
XhTeLkeUud8,cozy games for ios   15 cute amp comfy aesthetic mobile games for iphone amp ipad ,0
vzgDKXftAv8,chefe coringa  mc rick  netflix  se voc quiser eu te dou o mundo  prod reino na base bregafunk ,0
IBLYvKCnCoA,chess is dead heres why ,0
9yd3WI4UCYY,the witcher 3 henry cavill e temporada sem fim volume 2 ,0
Yr6tO2j5v9g,psychology of a hero moon knight and dissociative identity disorder ,0
ynvqJ326KhU,top 10 new survival games of 2023 ,0
DOMPU26i7Xw,being awesome ninja kidz music video ,0
gC3EvXtgxGI,home workout plan for weight loss and toning ,0
Yh9eYHi6cbw,would you let your kids play these sports ,0
SOP5v53DD74,moana live action  official trailer 2024 zendaya dwayne johnson  disney ,0
VQAWXxeHemg,best of arijit singhs 2023  arijit singh mashup songs  latest bollywood songs  indian songs ,0
g0_xCX9NyYY,funniest and cute moments in sports ,0
FBmybY8W8uU,i played 100 years of video games ,0
NTPXQUugyGw,badshah new song  bollywood party songs  best of badshah ,0
WbudwHROP3o,upper moon 1 kokushibo edit demonslayer edit anime ,0
GBHDZgg73ow,bro her father was born as an undead gay  badass anime moments ,0
5sMXR7rK40U,the decline of blockbusterwhat happened ,0
NQ1eqKQJwtw,justin bieber  lonely official live performance  vevo ,0
IjfocYTF9EQ,coldplay  the scientist piano cover ,0
6iGXZssxrAs,nhl greatest rookie goals of all time ,0
QtXt32hb8YE,party songs 2023 ll party music ll bollywoodsongs partymusic badshah honeysingh harrysandhu ,0
9-BMwKU-ixE,nirvana scorpion bon jovi aerosmith foreigner the eagles  slow rock love songs nonstop 80s 90s ,0
fWl1YtV6q7Y,chore baithe ncr official video  dev wrld  bad junkie  rap songs  new haryanvi song 2023 ,0
Kxl8CL52rBU,gunna  i was just thinking official video ,0
qRvXt8GfLDU,dont play sports if you have osgood schlatters shorts ,0
Wg92RrNhB8s,ariana grande  one last time lyric video ,0
n48kHm2HaV8,shenseea  sold out official visualizer ,0
bBqrgxAr_sk,the weeknd  a lesser man official audio ,0
B9PbeEvg6u8,enhypen  blockbuster feat yeonjun of txt full performance  2022 wev con ,0
pNpaxmniTIA,lego jason todd makes a good point  youtubeshorts explorepage redhood batman robin dccomics ,0
R5sUnwD2dgE,kamaru usman vs colby covington 2  free fight  ufc 294 ,0
BARkazmJ6EU,triton at lakeview  8th grade girls volleyball  8302023 ,0
1O6Qstncpnc,hogwarts legacy  official reveal trailer  ps5 ,0
kzZxEZhOTHE,i unfriended ninja on fortnite ,0
pw401-BABhU,bon jovi  always  electric guitar cover by kfir ochaion  nux mighty lite ,0
uexAzgRPZSA,most popular harp covers of popular songs 2018  the best harp music  harp cover version playlist ,0
4Ry1VrgGgY0,if demon slayer characters were just acting check out part 2 link in the comments and description ,0
4ONzD5rSB9A,amazon prime ,0
Tb6hllWrHM0,most popular song each month in the 50s ,0
V6ZsXKE8QmQ,gunna  fukumean official video ,0
6jP0z4Z3M98,my blockbuster video stories ,0
iI34LYmJ1Fs,juice wrld  robbery directed by cole bennett ,0
dvfZ95ueOcQ,selena  amor prohibido official music video ,0
5pyUtFE0Tno,do not buy red dead redemption on playstation 4 or nintendo switch  review ,0
VD73kVK01mA,the conjuring the devil made me do it  official hindi trailer ,0
ZQIZx5Oqw88,men39s 4x100m final  world athletics championships oregon 2022 ,0
md0_8YmGBss,m89kg european weightlifting championships 2023 ,0
pJcBq6B1SVY,jake harper boy genius  two and a half men ,0
jIq35IXMMA8,top 30 piano covers of popular songs 2023  best instrumental music for work study sleep ,0
HRv83mq8oI0,usa vs mex  full match  women39s u21 world championship  lon ,0
ewOppiD9ckI,lamborghini huracn sto amp ferrari 488 pista  forza horizon 5  thrustmaster t300rs gameplay ,0
fEFVHXYXGHk,top 10 essential profitable races in real racing 3 2021present ,0
UDcs_9MMR1E,cloud gaming fans are dreaming ,0
haHNb6CgO8E,nhl highlights  devils vs canadiens  october 24 2023 ,0
rUxyKA_-grg,lofi hip hop radio   beats to sleepchill to ,0
VPShStd8p3Q,why sitcoms stopped using laugh tracks  cheddar explains ,0
abr8zIGh7W4,top 7 esports games right now ,0
uGNYm3gPCBI,taylor swifts top 13 biggest songs according to billboard taylorswift swifties ,0
uqsvyj6lnnE,funny moments from season 6  friends ,0
m8Gh36lAnW4,all 87 mins of marvel amp mcu bloopers gag reel and funny outtakes 4k ,0
ZdNbo9Xab1w,top 10 most popular esports games in the world viral shorts top10 games ,0
34Na4j8AVgA,the weeknd  starboy ft daft punk official video ,0
05689ErDUdM,rap live radio 247  hiphop popular rap music amp uproxx sessions live performances ,0
atVof3pjT-I,kaun tujhe full  video  ms dhoni the untold story amaal mallik palaksushant singh disha patani ,0
bTvk1v_pl5g,20 things you somehow missed in titanic ,0
VXCaPR0exE8,attack on titan in 9 minutes ,0
3FC4YI_tryM,ronaldo va referees  football soccer shorts ,0
Q5nSDA_1y_8,ranking the transformers bayverse movies ,0
FveMfSpZkZg,rare footage darth vader being dressed on set of star wars starwars shorts ,0
oHTCK4mpH3k,top 10 most beautiful hip hop piano pieces vol 1 ,0
p0W8Gk-ilgM,the best moments from barbie amp her sisters in a puppy chase ,0
cMLMzpR26i4,red dead redemption ps5  the full game ,0
85yMDqAML-E,tipos de saque en el volleyball fun funny fail sport ,0
eIGh4Nc1fAM,logic  all i do official music video ,0
hOf1ywUiq9U,i hired fortnite kids to jumpscare me ,0
XEJLuJyxLDE,doja cat  like that official video ft gucci mane ,0
fSuKGLAO3f0,top 20 most cruel video games ever made ,0
shPefWPO3oo,      sports news  ekattor tv ,0
WzcjCrmKBqg,cix   cinema mv ,0
TiVkwrVHfrM,top 10 most popular eminem songs shorts ,0
xDJNIkaMjaw,two and a half men  charlies fiance answers a call from his ex ,0
IUCsw-Bhnko,how athletes come to class ,0
TbY_5mOBZlU,top trainers agree these are the 10 best musclebuilding exercises ,0
aL9K6M5ooSI,real racing 3 still the best racing game on mobile ,0
H7U4IR6sONM,3 tips on choosing your next electric guitar shorts ,0
Lhy7Ft4Pjno,did you know in the conjuring ,0
bkbT4n7flKg,denzel washington powerfull hollywood action movie  english action movie  hollywood movie hd ,0
9DZmKcQVUhU,top 10 best gaming laptops in 2023  hp omen envy pavilion spectre  gaming laptops prices  rja ,0
5zHQ4013ilE,nhl highlights  maple leafs vs capitals  october 24 2023 ,0
cOwDHqz4oGU,demon slayer season 4  official trailer ,0
neeVmfwyHs0,the original star wars sequel trilogy sounded amazing ,0
efUCB-RB23s,the 7 best tips for top lane in league of legends ,0
yZ0uETkXkSk,jaxk  nambo prod memax  official music video  bantai records ,0
SSdsncLXLYs,formula 1 explained for rookies ,0
X_YG4tZqJEk,the truth about building a digital imax camera ,0
VGk24PddSf4,metallica  master of puppets piano cover ,0
Kk9ZN0XLVYw,slipknot  duality drum cover ,0
paYa6m5yJEE,logic  beggin lyrics ,0
M1eXaMewsoQ,renting a movie on amazon prime be like amazonprime comedy rent thaddboii johnwick ,0
QNgKEX9cxwg,the oath  awardwinning batman fan film ,0
B12E7OoOmz4,the most calculated free to play ever genshin impact account review ,0
uelHwf8o7_U,eminem  love the way you lie ft rihanna ,0
wAXjyZa0dXQ,funny moments from season 5  the big bang theory ,0
AXKknuL3giY,best 900 gaming pc build guide  rtx 4060 i5 12600k w benchmarks ,0
gfcBswn2nH8,logic  aquarius iii ,0
lrpS69H1RRU,endgame ,0
XKpXTACHYFI,the best budget gaming laptop we have seen  ,0
SkJVV7shf34,chandler has a 3rd nipple  friends ,0
Xef05dQv9JE,increbles noticias del futuro de star wars  skeleton crew  eclipse  star wars  ,0
gaz5FsgkA2k,sir jim ratcliffe set to take control of manchester united football operations ,0
KuRu8T41u9M,why oppenheimer is a masterpiece  video essay ,0
xDmg5x14eQ4,g2 vs gen highlights all games r3 worlds main event 2023 g2 esports vs gen g by onivia ,0
R-7vCgq6qXM,duolingo x crunchyroll anime ,0
yRYFKcMa_Ek,daryl hall amp john oates  maneater official video ,0
mBSXXk6icOA,why oppenheimer in imax 70mm is rare ,0
Hwq-FGVtt0U,i beat the world 1 chess player ,0
QKNn_GXAMlw,top 5 best gaming laptops in 2023 so far ,0
yHQCSVx8n4c,the mcu timelineso far  cinematica ,0
KH7Mli_cKEs,top cello covers of popular songs 2018  best instrumental cello covers all time ,0
9KOKaqYoLAk,gunna  paybach official visualizer ,0
PNB5GZSZ__s,british couple reacts  most popular song each month in the 60s ,0
_3SNh5Ra9ck,carlos alcaraz vs alex de minaur for the title  queen39s 2023 final highlights ,0
WJ3-F02-F_Y,the most beautiful amp relaxing piano pieces vol 1 ,0
CQDPnJbBY5U,clash royale needs to ban this new toxic deck  ,0
edFW0JxfUXI,        worldcup  sportsnews  ekattor tv ,0
jpCbyVjdblc,best jukebox  arrahman39s hits superhit bollywood songs collection  audio jukebox ,0
Lqn3T3GFH0I,finally  sony play station 5    play has no limits  ,0
ydGiggLWFLQ,take on me  aha  drum cover ,0
Sv3uZURKHcE,best movie soundtracks 2022 the most beautiful epic amp awesome scores ,0
Us9PzySLfFM,10 tips i wish i knew before starting genshin impact ,0
sPw8YCBiRZQ,raj throws shade at neil degrasse tyson on live tv  the big bang theory ,0
faLPZbVjdpM,imax 70mm explained by christopher nolan  oppenheimer ,0
4cOVLVX7O6c,iann dior  you don39t even official visualizer ,0
Qc_5mweB2qw,maus  an indestructible steel wall  world of tanks ,0
EasloaGFNJA,the most respectful 1v1 i39ve seen in rocket league ,0
72TZvDU51aY,my all gaming phones from youtube money shorts ,0
duNv2_IplR4,bossfight  endgame monstercat release ,0
Td_HlQNbFNc,red dead redemption 1 in 2023 worth playing ,0
bBaB7hI_ot8,autumn classical piano  chopin debussy liszt mozart bach ,0
DlgDd_dBQV4,smino  quotno lsquot official visualizer ,0
FutULULDZqM,the evolution of iron man  tony stark animated ,0
izUk9vF3Vcc,day in the life of ben steeves at minnesota duluth ,0
nO48QYAS9Kg,red dead redemption nintendo switch review  is it worth it ,0
1tJfXM_wkLw,films vs ralit ,0
HEwFWFwPKmw,the warning  eminem music amp lyrics ,0
3CcH4FYhjo0,it was virat kohli alyssa helay speech about virat shorts cricket ,0
ObE5eeG6DLo,d o j a c a t  playlist best songs of doja cat ,0
5aU45TKmznY,top 18 best offline quotcontroller supportquot android amp ios games of all time ,0
Der9ZIwTsXM,top hits 2023  new popular songs 2023  billboard hot 100 this week   best hits music on spotify ,0
o3xnZ21FFIY,hakari is the cheat code  jujutsu kaisen ,0
cZx-Wg9oRYw,why avengers endgame is awful ,0
28hYUZMufDg,dababy  bop on broadway hip hop musical ,0
c9vdozGYB2s,there are too many games to play ,0
sWUgK8FrEHg,6 simple exercises to lose weight at home  no equipment needed ,0
R8Lwss7pHEk,top gun maverick 2022  hangman saves maverick amp rooster scene  movieclips ,0
Imy5l5d4L3c,the 2023 f1 sprint format changes explained ,0
hchgVxGa7XU,lonely orphan found a legendary demon lord sword at birth and instantly enjoys it  anime recap ,0
CuXdrFQHZ8U,ccm ft ghost hockey stick  first impressions ,0
Fkr63uKdCSQ,cristiano ronaldo is cooking at 38   football products in my bio ,0
yasj3j76SyM,the kid laroi  so done directed by cole bennett ,0
zbyrJuEMElg,cuando tim duncan despreci a michael jordan ,0
j7e7J9f8zUY,top 10 new release games for android 2023 newly released games in 2023  ,0
TOUaz6AAwG4,best car in hill climb racing   ,0
7MmIMZ3WrBM,craziest quot1 in a billionquot moments in sports history ,0
F2RnxZnubCM,titanic  my heart will go on  celine dion ,0
_EwJmaipueY,top 5 movies of marvel  shorts marvel  ,0
uLUWk7h5Vps,i built minecraft39s smallest base ,0
1ofQicr07Pc,christopher nolan in oppenheimer real nuclear bomb explode scene exclusive ,0
49-11hmWY9I,metallica  battery  drum cover ,0
egPriRsahGs,blockbuster ,0
nQJEp-k-ogs,ariana grande  pov audio ,0
Wfv0W7KJUio,ufc 294 embedded vlog series  episode 6 ,0
O9FJ6cX22Lo,finally opening 1000 super wheel spin  forza horizon 5  logitech g29 ,0
s6b33PTbGxk,britney spears  criminal official video ,0
t86sKsR4pnk,iron man  suit up scene  mark iii armor  movie clip hd ,0
tvZgpXt-fZw,the most beautiful amp relaxing anime piano music part 1 ,0
LOD2b1YwRew,hill climb racing garage race car  arena 36898 meters new stage record ,0
qFHQrAx2FaE,old school hip hop mix  snoop dogg dr dre eminem the game 50 cent  best rap songs ever ,0
elXpeJFTxT4,new summoning hack shorts  genshin impact ,0
ItgqSPQYCbY,90s rap music hits playlist  old school hip hop mix  classic hip hop playlist mix ,0
VLzmZDXn9So,anime voice actors old gen edition dragonball goku naruto luffy ichigo onepiece shorts ,0
nuoP_iCUA0c, kaan ayhan lockt bayernspieler nach istanbul  interview ,0
uh17Ld5p1KQ,top 50 songs popular 2023  billboard hot 50 this week  best pop music playlist on spotify 2023 ,0
ksAmUn1w9FY,beatbox sounds vs gayageum sounds ,0
TY5r0nEd2ag,empire of the ants  reveal teaser  ps5 games ,0
7wLlR9PmuaI,7 things no one tells you about building muscle after 40 ,0
UKaebGcUPMc,the weeknd  greatest hits full album  best songs collection 2023 ,0
rhxUr_z925s,12 things the witcher 3 doesn39t tell you ,0
77Gk7QnK0Iw,2023 iwf world weightlifting championship riyadh 89kg men groupa ,0
OelYMxrTpsk,the most painful attack on titan episode ,0
iPVL5tJuaCo,los cofres dan menos protogemas  genshin impact ,0
0GtoBaCYSw0,final  the greatest men39s team final in table tennis history ,0
3dSrvHm6Sa0,pakistani public viral reaction after losing match form afghanistan pak vs afg today match highlight ,0
BeFh4d7fn0Y,18 elixir cheapest goblin barrel deck in clash royale ,0
TH8HKvMIuGM, live powerlifting world classic open championships  men39s 105kg amp 120kg group a ,0
wKnXo9IH7TQ,it was actually not enough jungkook  the kid laroi jungkook amp central cee  too much reaction ,0
e20e-KRk-R8,doja cat  balut audio ,0
vOSIEeJP4m4,4 vs 4 pro beach volleyball crabbsanderranghierilucena vs beneshpartaingibbrosenthal ,0
K6WCcBP4lSs,the weeknd playboi carti madonna  popular official audio ,0
42ldx5KlKYI,michael jordan dealt with the celtics with ease 19970311 shorts ,0
5Me76JcCIyc,titanic movie crash scene ,0
H1XEwfOJshU,oppenheimer  opening look ,0
4V4xAse8vP4,22 awful changes in the attack on titan movie ,0
0H1Z5yYvOVw,cricket but it39s wickets you39ve never seen ,0
9fVYKsEmuRo,marvel39s spiderman 2  launch trailer i ps5 games ,0
ae1SotBuPJU,what if gojo came back gojo vs sukuna jujutsu kaisen animemangajujutsukaisenjjkgojosukuna ,0
c_LHt0BHP7o,alan buys a cute little porsche  two and a half men ,0
9ZwDfw3-ehk,is it the best budget gaming laptop ft lenovo loq ,0
HPUhiFQyvBM,hoyoverse va enfin changer ca  annonce live 42 amp giveaway primos   genshin impact ,0
WFs5fl8lVWw,freshman to watch out for this college basketball season ,0
df5Y-YtHwFY,new technical f1 rules for 2026 explained ,0
sV60PAUpiyA,furina kit buffs amp nerfs furina skills finalized genshin impact ,0
5an9W0An-zo,pure evil done right  jujutsu kaisen chapter 238 review better late than never ,0
