id,title,Category
Hni_iCyXpcE,flowering science neet views viral subscribe  biology botany shorts rhythm coaching classes ,1
FkKPsLxgpuY,i took an iq test to find out what it actually measures ,1
Ae4MadKPJC0,human body 101  national geographic ,1
_wzJnWCBWkI,you39re not slow become a speed learner in 20 minutes ,1
P9QaQ1XjZr8,how to crack jee main 2024 in 5 month  best strategy by vineet khatri sir  atp star ,1
sNgnwahAlzk,self taught programmers listen up ,1
NiF8nhDqhfE,the school trip  conversation in english  english communication lesson ,1
b_ONZrWAUZU,how to study for an exam the night before and still get all as ,1
9_WBQISVHnw,best learning video for toddlers learn colors with crayon surprises ,1
SeqKSRRpAH8,el hombre que mat y salv a millones ,1
11lPhMSulSU,physics crackpots a 39theory39 ,1
4RkWiNO3iq8,how i study smarter not harder ,1
YR2HO3Jnx9U,what to pack for college ,1
3yXlvkpov1c,grade 1 songs  learning song collection  scratch garden ,1
EQdVXPO6vg8,14 computer tricks you wish you learned sooner ,1
E456LCpIwVk,      padma bridge rail link project  munshiganj  train speed test ,1
HdU_rf7eMTI,math antics  long division with 2digit divisors ,1
24rZwis4npw,a playlist to romanticize studying math ,1
4nIFJFgH99w,how to make birria tacos ,1
AGKPeStDipE,math tests be like   4k memes  fyp viral ,1
vZbDk-Er344,5 undervalued skills in gymnastics ,1
Y_9t3eQFmU4,computer science basics programming languages ,1
KGWYaQX-oJM,my 6 favorite programming languages  and why ,1
VArTih2J8hA,jee mains 2024 safe score kya hoga kya competition badhega  jee 2024 iit jee esaral shorts ,1
avZGF0nAKm0,such a satisfying hit nintendo switch sports tennis clip ,1
bepMEodY1fA,exposing viral no glue no activator slime recipes how to make slime without glue amp activator diy ,1
9RzIUDuqp9s,such a pretty play   baseball sports shorts mlb ,1
cJb0Cn64ixA,derek carrs 1 problem  ,1
8mve0UoSxTo,mathematics is the queen of sciences ,1
6s09a6gag7g,meet the math facts  multiplication amp division level 1 free  preschool prep company ,1
Kp0F92QRmsk,air under 3000 assured scientifically proven  ,1
rCIjp_irGqE,gce math paper 1 common exam questions ,1
BkzPdgdxWBY,stop learning these programming languages as a beginner ,1
oJLA8iNUV-0,vampire biology explained  the science of vampirism ,1
qklRt4SWEtc,which clubs should you join for college ,1
fBXnxlLR0PY,study tips  how to learn new content ,1
AFD7eIiS4ac,no such thing as a free stadium  kent39s sports blog ,1
tEn5BjRY8Uw,how to learn python fast with chatgpt ,1
XEZRI3IhzHQ,story of a student from 11th wasted to iit jee air 1  iit motivation  esaral iitjee shorts ,1
WmDNXeZ2Jtg,do this before college ,1
5nnAkz0ulCc,amandhattarwal  reply to physicswallah ,1
SIsCy663mz4,the most important skill for improving your life ,1
jA3WpoDOp6A,how to backflip in only 3 steps ,1
b093aqAZiPU, python for beginners tutorial ,1
PHkFoiqTe9o,exercise amp sugar when sugar can be a good thing ,1
WiWsnItm9JU,become god of physics in 3 months  target iit bombay  ,1
Xxd6TjkEFaA,learn new skills easily ,1
AZsmyTE3j9o,the mindbending physics of time  sean carroll ,1
rb7NddXDdxs,deepfakes destruction artificial intelligence39s real danger to humanity ,1
SyvKvdlECYk,   alakh sir talk  16hr study motivation  iit jee neet motivation  physicswallah ,1
vqI84pkCcWQ,wayne rooney praises jude bellingham  football realmadrid shorts ,1
ISdBAf-ysI0,einstein39s quantum physics theory that proved him wrong  the secrets of quantum physics  spark ,1
094y1Z2wpJg,the simplest math problem no one can solve  collatz conjecture ,1
5MgBikgcWnY,the first 20 hours  how to learn anything  josh kaufman  tedxcsu ,1
tc-uEuDCE2Y,jee advanced 2023 physics analysis amp cutoff  learning for jee 2024 shorts iit esaral ,1
RkxELmZAyFo,learn the skill win 2000 ,1
O9S70oJAivI,learn all the tenses in english complete course ,1
GnQ1caXSZcg,think in english and speak confidently your ultimate english learning course ,1
iQOibpIDx-4,the physics of ufos eric weinstein  hal puthoff ,1
rKHIfsHX1aA,plant hormones  tropisms amp auxins  52 ,1
79pKwdiqcwI,fastest way to learn coding and actually get a job ,1
WiWsnItm9JU,become god of physics in 3 months  target iit bombay  ,1
yG7z8XtZGMk,how to learn insanely difficult subjects easily ,1
xkYved-ucGg,learn to talk with ms rachel  videos for toddlers  nursery rhymes amp kids songs  speech practice ,1
lv6dC0coQeI,earth science for kids  solar system weather fossils volcanoes amp more  rock 39n learn ,1
tea0Jj4xpbs,examining the use of ai in areas such as sports gaming and entertainment including the development ,1
RdzCXBgB-9s,mini math movies compilation  math video collection  scratch garden ,1
HlPp956K8t8,top 5 programming languages to learn in 2023 ,1
w92l0NV-U1E,jee 2024 jan attempt  99ile  ka easiest  iit motivation iitjee jee2024 esaral ,1
TyV-OhCrVDA,learn colors fruits and vegetables with ms rachel  toddler learning video  speech  1 ,1
3oOipgCbLIk,online machine learning  online learning  online vs offline machine learning ,1
EPylVlpKpZA,how to start programming ,1
TT_LozsXu9c,how to make your own diy stickers at home   super easy ,1
Y-ET7e7R1Jo,how to do calligraphy with brush pens  super easy beginner lettering tutorial  shorts ,1
5q87K1WaoFI,computer scientist explains machine learning in 5 levels of difficulty  wired ,1
Q8ijKtdIRMQ,biology 1010 lecture 1 intro to biology ,1
v43wkQJ-Bwo,first lecture of alakh panday  shriidhar dubey  physics wallah  amazon minitv ,1
qQXXI5QFUfw,new most popular programming languages 1965  2022 ,1
KxwiWiO7xOc,jee 2024  expected marks vs percentile in 1st attempt  iit motivation shorts esaral jeemains ,1
eGkq_kJF1Ic,biology experiments at homebiologystomataoxygenphotosynthesisplants ,1
jhwvCKrUq9U,does the spinning wheel defy gravity no it obeys physics funny fyp reels shorts shortsvideo ,1
u49MZH-FFa4,5 top skills to learn in college ,1
TzCq2rsT7IY,     bangla news  25 october 2023  400 pm  banglavision news ,1
DIKySS3G1HI,jee mains paper will change drastically by jee 2024 update  jab kicked nta jee iit esaral ,1
iWaX97p6y9U,the reproductive lives of nonvascular plants alternation of generations  crash course biology 36 ,1
5xPjEq0VRd8,my honest jee mains exam day story  ,1
fjFYb-lrf7E,all computer science degree courses for free harvard mit free courses ,1
t8x3wdXZGEY,what is chemistry ,1
CypldGcP4dE,what happens when you microwave soap science shorts experiment ,1
zxunrkpGOC4,jee mains exam tips amp suggestions  jee 2024 ,1
Pq8Ee6W25jo,such a shot will upset anyone  sports nhl highlight ,1
fL6_hgaUGYw,botanical science for beginners ,1
I55CDR7wblY,irodov for jee physics  sufficient good or not  ,1
brInNApdbL4,how to learn anything fast teach your brain to focus ,1
DwsKeoXOa9I,basic computing skills  orientation ,1
6r3Eqtl3nDM,colourful math for kids  numberblocks 1 hour compilation  123  numbers cartoon for kids ,1
oC5nhc_eEH8,10 difficult skills that pay off forever ,1
KYIldbgmza0,a day in my life busy college student edition 50 ,1
dLbDyBambPc,how to do a back walkover in one day ,1
MHPGeQD8TvI,how i would learn to code if i could start over ,1
ZM56Z_hYvAQ,jee advanced 2023 tips amp cheat codes to ace jee advanced  pcm time hacks  nabamita ma39am ,1
ZxNSed7nOWA,sports concussion  shorts ,1
kTXTPe3wahc,parallel worlds probably exist heres why ,1
pB2nVLrIJuA,luca morris  computer technology ,1
e_1utfWwdD4,the human body  facts about the parts of the human body system ,1
B8y3SSmz4sg,how to make ramen ,1
4HUCJliVbsw,the best of toddler fun learning  learning videos for toddlers ,1
Frc8wYUb5T8,how to do a needle fast best flexibility stretches ,1
mw0LGzIKvoo,how to learn to code fast do this or keep struggling ,1
G7ec7qCHwzc,how to make an easy paper airplane in 1 minute 60 seconds competition winner  flies 100 feet ,1
gD7spIB_Q14,quantum physics 101 with neil degrasse tyson ,1
TkZmaamYDSI,khan sir vs physics wallah i youtuber39s comparison i shorts i khansir i physicswallah ,1
zaGwW2vNHlw,the best free coding courses no one will tell you learn to code for free ,1
frVnzTdxcL0,what is quantum computer with full information  hindi  quick support ,1
Oq65fZr7wi8,how to master any skill become top 1 ,1
Xh8UKpEKE6w,how to make someone obsessed with you ,1
TfwaEhNg9Oc,the attribute of light science still can39t explain ,1
9s29LKfEFjQ,how i would learn to code if i could start over ,1
75W2CLnPerM,get certified for free 20 musttake online courses shorts ,1
TjPFZaMe2yw,3 tips on how to study effectively ,1
jEPm1sB-j10,lisa is sued  conversation in english  english communication lesson ,1
JYpGPRA9-xk,reflection of light  best practical  light shorts light science education ,1
6otBnS2SXhU,let39s learn english topic sleep  lesson only ,1
0yXMGQaVVXg,central nervous system  3d video 3d animation  biology topic ,1
Lk9LAnptgnc,respiratory system  animation  biological short animated video   shorts shortvideo ,1
cfFRxsQAbAc,improve your english  english story  a girl in a cafe  the stolen sketchbooks  level 3 ,1
ubJD14AcGlc,75 will get wrong zero to 2nd power  zero to zero power   no calculator ,1
RgGWoxRBvsg,the deadly chemistry that made life interesting ,1
TkZmaamYDSI,khan sir vs physics wallah i youtuber39s comparison i shorts i khansir i physicswallah ,1
VsWgKXHRDic,8   16       toppers39s secret ,1
2th5lAd-77A,what is botany crash course botany 1 ,1
UgjRhTWJF0I,how to avoid student loans 101  shorts finance money college graduation ,1
pN5otq1birg,3 vedic methods to learn anything faster decoding vedic methods prashant kirad ,1
f_uwKZIAeM0,what is machine learning ,1
nVN0WsfQoNY,wrong ways to improve your physics ,1
EwSHKuSxX_8,vectors  basic introduction  physics ,1
TFLNUlu_17E,minecraft how to make a doorbell easy ,1
qVlfDmr9mzE,backbencher physicswallah ashortaday ,1
8DvywoWv6fI,python for everybody  full university python course ,1
LF5jwuRGGPY,why there39s no such thing as goat in team sports like basketball ,1
U5R_4btyYiU,the 3 courses that taught me web development  2023 version ,1
2eXCKFMzg2w,how to make a big mac ,1
SoyNG31EAUw,top skills to learn before your 30s  ankur warikoo hindi video  online courses my recommendations ,1
F-AbnZJJTEQ,pat bev is such an wholesome playershorts blowup sports viral ,1
WR1ydijTx5E,how i learned to code in 4 months amp got a job no cs degree no bootcamp ,1
-1SmUivH9dQ,where to start learning how to code ,1
lFlu60qs7_4,how one line in the oldest math text hinted at hidden universes ,1
To8hKb112Aw,how i would learn to code if i could start over ,1
f3vIYs74Jf4,viral video  student thrashes physics wallah teacher with slipper during live class  latest news ,1
4Stzj2_Rlo4,we did the math  you are dead ,1
ZTavfFXOTzY,the best 5 programming languages for beginners  technology programming software business ,1
0cYal_hitz4,the 6 types of joints  human anatomy for artists ,1
ksV8DbaI-50,awesome math iq testpart489 education tricks fun iq math mathematics shortvideo shorts ,1
MKg0NzlPOew,engineering company looks at the future of ai ,1
TrU5g19Om0k,how your kidneys filter gallons of blood ,1
RuJ0j1AfRl0,why are women39s sports referred to as such and men39s sports just referred to as sports ,1
C7ATuFx8WA8,physics of the impossible michio kaku quantum physics audio book ,1
j9rLiSLIsh4,ati teas version 7 science chemistry how to get the perfect score ,1
pEfrdAtAmqk,godtier developer roadmap ,1
dHjWVlfNraM,kinematics in one dimension  physics ,1
9poeKU0YCQU,how to make an easy origami fortune teller aadrit39s origami ,1
BC1lLTpU3V0,top 5 google certifications in 2023 ,1
HhGEyyGT9Ko,neural revision method to get iit amp aiims  by ashish arora ,1
RJ4gl0Lmac4,jee mains 2024 chemistry strategy to get 100100 in 3 months jee mains 2024  iit motivation jee ,1
OQjkFQAIOck,maths quiz for kids  multiplication table quiz for kids  quiz time  ,1
difvQyWFmxw,technology i  vocabulary for kids  laptop monitor mouse speakers webcam microphone ,1
n6wpNhyreDE,the chemistry of cookies  stephanie warren ,1
rK_jcQl644M,graph physics galaxy ,1
zwGKoaZOAG0,learning the world39s deadliest skills ,1
QvdEIZ-7Eq8,last 10 day strategy for top iits  jee advanced 2023  vineet khatri sir  atp star kota ,1
FKv8NqgD51E,python is bad for beginners  prime reacts ,1
50klx9Q5ls8,baby learning videos  babies and toddlers learn colors first words shapes abc  lucas amp friends ,1
8cR_1Qi-tP4,meet the math facts  addition amp subtraction level 1 free  preschool prep company ,1
aSESxwH3I74,how physics wallahs39s genius marketing strategy made it a unicorn  physicswallah ,1
9SFQ7k5m4-4,this discovery just won the nobel prize in physics ,1
8DBhTXM_Br4,how the most useless branch of math could save your life ,1
jI0BKpwOaFs,how to whistle without your fingers ,1
HeQX2HjkcNo,math39s fundamental flaw ,1
GVsUOuSjvcg,future computers will be radically different analog computing ,1
453mpKHVaBs,how to make churros ,1
G_pWYPsTTgw,top 3 free online courses to learn c ,1
X-aPynK9m8U,how to make skittles ,1
3TZgkUWjxT0,rajwant sir supremacy  physicswallah ashortaday ,1
I-k-iTUMQAY,basics of coding in 10 minutes ,1
WQoGHig4GT0,4 amazing free online courses to learn c ,1
CNGn1qQCn4c,plant structure a summary of key features for leaving cert biology ireland revision ,1
dBap_Lp-0oc,the illusion only some people can see ,1
mut8eTdoRxU,how i39d learn python for data analysis  if i had to start over again ,1
asAd-E5_HPo,chemist breaks down 22 chemistry scenes from movies amp tv  wired ,1
6N0YPw7ogJw,asians could be all above average in math ,1
o21LkcxuLx8,14 online courses that can make you rich  ankur warikoo hindi ,1
Wg-2ceZA-yU,sslc chemistry  one shot series  production of metals    chapter 4   exam winner ,1
BOhnFkgt5Xs,you39re 18 you need these skills ,1
RT-w2xHVl_E,biopl3420  plant physiology  lecture 1 ,1
w_x-WDdQdxI,plant nutrition  plants  biology  fuseschool ,1
NIVkBs7oWDI,turning paint thinner into cherry soda ,1
SsEHgLNFGVk,chemistry prod czaer ,1
j4opWj2dYX4,the classes colleges want you to take ,1
fIM6943BSRA,testing crazy chemistry recipes from a 1933 formulary book part 4 ,1
OuTx4K0mUaY,8 google courses you can learn for free ,1
_f-qkGJBPts,how to learn faster with the feynman technique example included ,1
hPgaC1r4JTM,how to get flexible legs fast ,1
ZbpRlKRaE8Q,what is quantum mechanics explained ,1
JP9n5wHyemU,making my own programming language and coding a game in it ,1
ITOXb8K74is,math quiz for kids  one digit addition quiz  mental math quiz for kids  quiz time ,1
3Lpqg7m_ocA,10 computer tricks to become expert in computer ,1
Rn9OmxLDdXM,what is machine learning ,1
mitICGPhorM,ruler of jee advance  iit viral shorts motivation neet topper jeeresults ,1
eGR2Yf6yBRA,how to choose a major  crash course  how to college ,1
PkoYtr7i0oc,making of physics galaxy books ,1
bHoAx7giqi8,real english conversation  fast english ,1
Xmrzr0GTEE0,checking jee main result 2022air 3 ,1
OQ0k9rIFoVE,learn english through story  level 3  albert einstein  graded reader  wooenglish ,1
F5pl6VmXgpA,which chemical do i hate the most ,1
NyfNxspBfsc,why does quantum entanglement defy all logic  secrets of quantum physics  progress ,1
SAhiIlTxUYA,how to make a paper fortune teller  easy origami ,1
KcTMbapo-9I,when english is your second language ,1
SVb7fGRuRMU,become a top 1 student  study tips organization hacks and motivation to always get straight a39s ,1
q0N7rDhTcEA,quantum physics part 2 superposition particle in a box  lecture for sleep amp study ,1
jb4CMnT2-ao,6 chemical reactions that changed history ,1
BpLDg9gs0Qw,the real reason why you39re bad or good at math ,1
MDWAx_XqhEo,advice for your college essay ,1
4hddxkhta3w,physicists proved the universe doesn39t exist ,1
dP37Y6mddeQ,maths super tricks  dear sir  shorts maths shorttrick mathstricks examtrick ,1
V_xro1bcAuA,pytorch for deep learning amp machine learning  full course ,1
HXoEMCjnWSc,i learned how to make rise art in a minute shorts ,1
Hve8_iSDD-o,the insane biology of the sperm whale ,1
g20JZ2HNZaw,the best and worst prediction in science ,1
Rv9qn3OfrNM,3 easiest programming languages to learn programming tech technology software code career ,1
Tck7MFXRQZg,top 10 programming languages in 2022  best programming languages to learn in 2022  simplilearn ,1
VupkZcaim3s,physics wallah  or  physics galaxy jee math ,1
DWjAeulMer0,i learned 167 skills in 3 years can i still do them ,1
mjlsSYLLOSE,basic math addition for kids  noodle kidz prek and kindergarten 1 video ,1
0zQaNicTyCM,how to learn a skill faster  andrew huberman ,1
O96fE1E-rf8,learning how to learn  barbara oakley  tedxoaklanduniversity ,1
RdzCXBgB-9s,mini math movies compilation  math video collection  scratch garden ,1
W9ls1K-UfEE,newton39s laws of motion  revision checklist 04 for jee main amp neet physics ,1
wENhHnJI1ys,map of biology ,1
tcpO1UWP2Mg,how i would learn to code in 2023 if i had to start over ,1
qvHeoh-SWK4,learn robotics and ai for free  university courses online right here ,1
OZsHw9yhx6M,he may get air  1 in 2024 ,1
jVsM8aBEGHg,human body  and human body size comparison  human anatomy size comparisons ,1
wwbM63-LFD4,why you should not learn to code as an exgoogle programmer ,1
R9yjBz1gaHs,last 03 months strategy jee 2024  jee main 2024  12th student    rajwant sir honest talk ,1
6Xq6FIpad_E,jee mains2024 99 strategy in 100 days in honest strategy motivation ,1
vlIO-7Rpi7c,this is your body on vegetables ,1
opRm3x9vHH0,programming language tier list ,1
g6CVApMxmqg,phonics counting colors  more kids learning songs amp nursery rhymes  gracies corner compilation ,1
DnCkf93dLe0,3 plus 12 divided by 4squared times 2   basic math  focus on the order of operations ,1
mzuQKQ2Wy3E,michio kaku explains the mysteries of string theory amp quantum physics ,1
wb7191WNvus,basic vs advanced english ,1
2lVDktWK-pc,the programming language guide ,1
kqtD5dpn9C8,python for beginners  learn python in 1 hour ,1
yd0hcCK-hgs,apocalypse gpt why we must shut down the artificial intelligence revolution now  glenn tv  ep 276 ,1
0RRVV4Diomg,the periodic table crash course chemistry 4 ,1
ITOXb8K74is,math quiz for kids  one digit addition quiz  mental math quiz for kids  quiz time ,1
rVAclbybV4s,what lsd does to the brain ,1
ZfF2KPazvH4,the asian secret to studying effectively ,1
CM0aohBfUTc,veritasium a story of youtube propaganda ,1
co0JdqUlycg,structure of the leaf  plant  biology  the fuseschool ,1
usCC7MHqopU,rebirth and rise  ,1
MTJZpO3bTpg,openai ceo on artificial intelligence changing society ,1
tRaq4aYPzCc,mathematicians use numbers differently from the rest of us ,1
vwAJ8ByQH2U,biology  intro to cell structure  quick review ,1
ZdRzq5npaIo,learn countries with chris and mom  kids adventures ,1
B9SptdjpJBQ,how to learn faster ,1
gIcI3akFS0Y, tooth brush strategy  of time management for jee amp neet aspirants  ,1
f-FF7Qigd3U,the skeletal system ,1
3I5QHFRmUcc,the levitating water experiment what39s the secret water science isitice ,1
YTSBZJWuTQk,best learning videos for toddlers  learn shapes for children with fun play wooden toy truck ,1
oefAI2x2CQM,protein synthesis updated ,1
7l2Qa7AWmgo,     revision strategy  jee mains exam12th student    rajwant sir honest talk ,1
rfscVS0vtbw,learn python  full course for beginners tutorial ,1
9HiADisBfQ0,the secret language of trees ,1
8rDpApFgukc,what color is math ,1
l6jvJhcr314,relatives reaction at my iit result iit jee2024 jee2025 ,1
9018sDL_PzM,human anatomy and organ system physiology ,1
9MIwfLrRbZ8,5 best and worst paying college majors ,1
gEUu-A2wfSE,human body systems functions overview the 11 champions updated ,1
Ydo2Nj8ztrU,how dirty is this dell inspiron pc  let39s clean this computer  tech technology shorts ,1
XMOOz3CgNNA,theres no such thing as a dumb jock  to play professional sports at a high level ,1
gFo2dZgAMh8,pps board meeting about august 2020 decisions for sports and such ,1
Q7x5fouy8zE,learn this easy skill to beat defenders  ,1
i_LwzRVP7bg,machine learning for everybody  full course ,1
Ck6duMcfNCc,you need such a sports smart watch ,1
_Bf5WKEMB5o,gcse biology revision quotplant hormonesquot triple ,1
JxUEIqg-Zkk,college dorm hacks that no one ever tells you pt 7  scott frenzel shorts30 collegetips ,1
BQnrjQYm9pc,jee mains 2024  jee mains exam reduced syllabus 12th student    rajwant sir honest talk ,1
4V0cIzS9Aj0,lil tecca  chemistry official lyric visualizer ,1
q4ONRJ1kTdA,does our reality really exist  exploring the world of quantum physics  spark ,1
RyRo8eVsrlU,stop learning these programming languages for beginners ,1
jvXfxs0bTho,students get college applications judged in person  hot seat ,1
csM8wWsoToE,toughest topic from the toughest subject in jee advanced  iit motivation status  motivation kaksha ,1
8-G7D_sy7qE,plant science an introduction to botany  wondrium ,1
XatgMUamqOM,jee 2024 complete details  exam pattern negative marking bonus marks  jee mains amp advanced ,1
FbBXtqtRnWU,introducing python in excel  ,1
vcTn_Cq4TGA,physics wallah teacher assaulted by a student watch viral video ,1
itY6VWpdECc,megathreat why ai is so dangerous amp how it could destroy humanity  mo gawdat ,1
NfmSjGbnEWk,attosecond lasers 2023 nobel prize in physics  sixty symbols ,1
8l4UWz48Elc,python 312 is here ,1
xB2DiiAOpCg,the science of fall  compilation  scishow kids ,1
5MgBikgcWnY,the first 20 hours  how to learn anything  josh kaufman  tedxcsu ,1
880TBXMuzmk,the ai revolution google39s developers on the future of artificial intelligence  60 minutes ,1
6DHgkMYgp7w,the mass extinction debates a science communication odyssey ,1
48pZWbXx-Hw,astronomy vs mathematics  science physics maths shorts ,1
fnh94Vv1nkI,end of all backlog in 1 week ,1
xBRw4sqVFew,how to make a paper boomerang  paper origami  boomerang ,1
xUoFhcQBiZY,how to make the best coffee according to science ,1
Iu7znMM7_Fs,toughest question of jee advanced ,1
MCzptRuL6fE,5 online courses average students must take highly reputed ,1
k9ZT2YWkLBI,meet the math facts  addition amp subtraction level 3 free  preschool prep company ,1
rfscVS0vtbw,learn python  full course for beginners tutorial ,1
Rr0uFzAOQus,learn abcs with morphle and mila  learning videos  cartoons for kids  morphle tv ,1
povt_amQ91k,top 10 medical colleges neetug mbbscollege aryanrajsinghaiimsdelhi ,1
24ecRKfEweU,how to study only 2 hours a day yet still ace your exams ,1
2hoZl4LW8no,country humans  science  ,1
WNWVIhwtwoI,a common college essay mistake ,1
cGjgsyizx_A,transform yourself into a super human  ,1
ti_E2ZKZpC4,chemical curiosities surprising science and dramatic demonstrations  with chris bishop ,1
SDxzZHSBhw0,neil degrasse tyson explains the weirdness of quantum physics ,1
Aa-vbWti7gQ,what to do with such a naughty kid shorts ,1
kKvK2foOTJM,brain hack 6 secrets to learning faster backed by neuroscience  lila landowski  tedxhobart ,1
ovJcsL7vyrk,this equation will change how you see the world the logistic map ,1
McM3CfDjGs0,youtubes science scam crisis ,1
ilamNAj9Vz4,hyper sports arcade  such a hard game ,1
H0jCN8typaY,top 3 free online courses to learn php ,1
RCiSwiwQxcY,raptrap247 x such a whore x sports car edit ,1
7TBMnahL6LQ,79 students don39t follow amp lose jee advanced every year  iitjee booster ,1
SYKVsMMCOl4,how your body really burns fat can we control it ,1
LDRtqPbqkXA,air1 jee advanced  topper of jee advanced 2023 chidvilas reddy  infinity learn jee ,1
6erR3W0y9oU,do no glue slime recipes work  how to make slime without glue and activator ,1
1IQGNOTK4vI,best free uiux design courses you must take   ishan sharma shorts ,1
zAKStNdNn-U,catch the math  free maths classes for all railway exams 2023  class  60  maths by sahil sir ,1
KsXp22QLMv0,fastest way to learn coding and actually get a job ,1
rDGqkMHPDqE,the skeletal system crash course anatomy amp physiology 19 ,1
KT18KJouHWg,how they caught the golden state killer ,1
ChoeKcjlYuI,learn python with chatgpt ,1
EGQh5SZctaE,what is a programming language ,1
w_ysxZqQoXg,basic english conversation practice for kids  chapter 1 to 20 ,1
gAFAj3pzvAA,the map of quantum physics ,1
unityETmypk,how to learn anything faster ,1
KODuBO0Cq6U,batman arkham asylum  sports and such  playthroughwalkthrough ,1
lY3jhUhVxK0,ibm39s new quantum computer shocks the entire industry ,1
I4pQbo5MQOs,the paradox at the heart of mathematics gdel39s incompleteness theorem  marcus du sautoy ,1
NJ8hQy15gQo,video video centralia school district discusses cutting positions programs such as sports ,1
Enk8ldkpYC4,        bangabandhu tunnel  patenga sea beach ,1
_K1UmdKgnzw,jee main 2024 3 month strategy to get 200 marks ,1
MkP9Qp1WXmI,exercise your body with sports such as badminton and volleyball p68 ,1
-KfG8kH-r3Y,chemistry ,1
fh3VtUmvvME,werewolf biology explained  the science of lycanthropy ,1
xhe1_xQi4LA,salary  of a btech computer science degree   ,1
uI_zbyi49wc,toughest question of jee advanced 2022  jee advanced 2023  arvind kalia sir  vedantu ,1
I7NrVwm3apg,machine learning algorithms  machine learning tutorial  data science algorithms  simplilearn ,1
U0ORJ9AjFXM,jee mains 2024 99ile strategy complete iit jee syllabus in 100 days jee 2024 roadmapjee ,1
7L7x0BAqWis,introduction to biology hd ,1
NtfbWkxJTHw,how to learn to code  8 hard truths ,1
nKW8Ndu7Mjw,the 7 steps of machine learning ,1
UuzZYVRcemY,alpha class 11 chapter 2   units and measurement 01  introduction to dimensions jeeneet ,1
D0BF5JuC6Mw,the best free cyber security courses for beginners ,1
PByE1R1ip88,the bible predicts artificial intelligence will kill  prophecy of the antichrist image of the beast ,1
Kryvqv_PW7k,how to make caramel ,1
6q1RH8A3O3c,what alcohol does to your body ,1
QuCMI9V4FMA,predictor paper  jee advanced 2023  jeeadvanced jee2023  unacademy jee ,1
SDxzZHSBhw0,neil degrasse tyson explains the weirdness of quantum physics ,1
Ualg6nzN3vk,average to iit bombay  in 6 months  iit motivation shorts esaral iit jee ,1
GnZWPfr_Gus,ismail sabri plan on contact sports such as football to be tabled next week ,1
eexEXeUJ_9Q,the last chance  score 95 in just 3 months  class 10th ,1
