id,title,Category
6T65GqiqIOg,scope of all engineering branches after 45 years  josaa choice filling ,1
JmLOaDZJfpg,how to make a latte coffee ,1
FBvjro4-7yc,never pour water into acid  shorts science chemistry ,1
mgsikzqbiWM,99 of math students get this step confused ,1
t-_VPRCtiUg,the surprising secret of synchronization ,1
ax0yjzbSBa4,all of biology in 9 minutes ,1
vzk5DCFJr8c,5 best programming language to learn 2023  which programming language to learn in 2023 simplilearn ,1
K-Fc08X56R0,3 perplexing physics problems ,1
97_X9_4Z2lY, look at this law law law law 49ers brock purdy ints party ,1
ox8iPGytp3w,how to make homemade tofu  ,1
Un-BdBSOGKY,how to make a flipbook ,1
wEulsc5L3Tk,science of meditation brain waves 101 ,1
m_Aa-JCh68Q,jee main 2024 block strategy  250 sure in 90 days study plan ,1
5hsBbaWzuMQ,tech degree tier list best technology majors ranked ,1
lWI1CHKTfF0,27 quick and easy crafts to make at home ,1
9oGEeAdgFEo,how to know if you can play pro video games for a living ,0
NDLX24n5yxM,this is animegoku ,0
pPNV3nX7iVs,greatest goals ever by lionel messi ,0
hNw4Pp-_fgA,my top 25 favorite movies of alltime ,0
D0hEB4-1zqU,c0 wriothesley is awesome but has some problems genshin impact ,0
2m2if-NCs24,   gta 5         ,0
pqSN7lsPs2k,playerunknown39s battlegrounds the zone ,0
gyd0V5vTnw4,94  why i quit bodybuilding  cutler cast ,0
QCftIjC64ac,messi 2 goal argentina vs peru 20  all goals amp highlights  2023 ,0
Db2OLvdhsDk,volver  tainy rauw alejandro skrillex four tet official visualizer ,0
WSdEuYDztvw,which electric guitar type is for you ,0
_ecXNJP-ERY,harry styles  cinema audio ,0
uDZM_EU-be8,maple grove vs st michaelalbertville girls high school volleyball ,0
h9Q4zZS2v1k,the conjuring the devil made me do it  official trailer ,0
S9DnaBlhlVI,how to play tennis  tennis rules  the rules of tennis explained ,0
c-t8kGmnl40,penny guest hosts 39fun with flags39  the big bang theory ,0
byUOJAH4j20,chess cheating scandal final update ,0
2F--yttCdV4, top 10 highest grossing  indian  films  ,0
dCtXOfhjyf8,greatest sports moments 20002017 ,0
QOm1-PFsLv0,the sound of silence  nini music  joy asian folk cover ,0
aoOQL7fiMCQ,thunderstruck  nini music  zuiko asian folk cover ,0
UPIMfaUMPeQ,top 5 colorful battle royale games  may 2022  like free fire  like pubg  like bgmi ,0
NPUIsur-vEY,who killed franklin in gta 5 ,0
9vw2MvyBjUQ,naach meri jaan lyric  tubelightsalman khansohail khanpritamkamaal khannakash aziz ,0
DWqoqS8HHGU,why oppenheimer in 70mm imax film is huge ,0
OPKc2X3-fQM,pubg is still my favorite battle royale experience ,0
kvC6baB_IfY,nicole paris viral beatbox  shorts beatbox reaction ,0
3dLDPhdLDdk,calisthenics for beginners 2023 ,0
Ad5TrR5QCQ8,honeypot  spy x family ,0
tUHuaSWTbfU,juice wrld39s freestyle for xxxtentacion  rip ,0
iNrkStFR7vo,denzel washington admits that michael jordan is the goat  shorts denzelwashington michaeljordan ,0
0ET7QAJ39KM,jujutsu kaisen 240 spoilers  el power up de itadori  kenjaku descubre la debilidad de takaba ,0
azJGBCHz34Q,iconic paris sites get ready to take center stage for 2024 olympics ,0
8WtIQoWnVIQ,neega mobile or pc la games lam velaiyaduvigala pochi must know this ,0
YQZJinEtFlM,top 10 best movies of 2023 so far ,0
Kumjs5z7IL4,dababy   beatbox freestyle ,0
ACl1GHAk4RU,messi edit  ,0
aAhghoA2wuA,the actual fastest athlete in the world right now ,0
Cog_VXZEse4,partners in rhyme season 1 episode 1  full episode  allblk ,0
0QUxJ57N9I0,see how oppenheimer 1570mm imax film is projected ,0
t5ZB769dW5s,9039s romantic songs  audio jukebox  9039s bollywood songs  full songs non stop ,0
agXQQDasq0U,doja cat  attention official video ,0
SAGSsUJkIfo,top 15 best movies on netflix to watch now 2023 ,0
u1ZGnkeaU_Q,top gun maverick  ultimate soundtrack suite ,0
i0FLn9j60Ys,top 100 songs of 2022 2023  billboard hot 100 this week  best pop music playlist on spotify 2023 ,0
BPgEgaPk62M,ariana grande  one last time official ,0
ffxKSjUwKdU,ariana grande  no tears left to cry official video ,0
tsH708lC6fE,every olympic amp paralympic mascot ,0
V5O_PEkwFaU,epic moment badminton ,0
EH6R27Y7czw,old vs new bollywood mashup 2023  superhits romantic hindi songs mashup live  dj mashup 2023 ,0
eLMsCa1O8YM,being a bad wizard in hogwarts legacy ,0
yYDF3-8mfC8,tiktok mashups augustoctober dances 2023  clean  song names added ,0
OSsntU6sTWI,muscular system for kids  muscles for kids  a fun intro to the muscular system ,0
BmvZiGMhYXw,full body vs split training which is best ,0
QCQysR5aXMc,i broke 100 laws in gta 5 ,0
2CsTzVyZP4M,barbie an accidental antiwoke masterpiece ,0
c0i88t0Kacs,the witcher 3 wild hunt  killing monsters cinematic trailer ,0
Q5JKjIetyjI,bon jovi  bed of roses  electric guitar cover by kfir ochaion  fender american pro ii ,0
Y72KY-y0bdk,portugal the man  plastic island official visualizer ,0
S9bCLPwzSC0,eminem  mockingbird official music video ,0
0SDaT7PAwgs,juice wrld freestyles xxxtentacion  sad  ,0
EH70M5OeS4o,taylor swift  better than revenge taylor39s version lyric video ,0
16BcoaAVG8c,something is wrong with doja cat ,0
n_UQ5nrXpQ0,day 5 highlights  world athletics championships budapest 23 ,0
hnV26cgHny4,microsoft flight simulator 2024  all the details ,0
YRD-G_v-xm8,legendary pacer wasimakram lashes out at the pakistan cricket team following their upset defeat ,0
AlyocIaY1bQ,leonard lied about the quotexclusivequot club  the big bang theory ,0
lyuqLhqXnMM,mappa just dropped an unreal fight  jujutsu kaisen season 2 episode 13 breakdownanalysis ,0
AtZRlH5rtr8,powerlifters try to complete the most difficult calisthenics exercises ,0
vW-CZYpF77A, roblox  games to play when your bored  ,0
dGq_4-7sGNE,best of kk  kk songs  juke box  best bollywood songs of kk  kk hit songs ,0
7_LZFmfeCuk,sliding filament theory  muscle contraction ,0
3q_ijl-aaTI,metro boomin future  too many nights visualizer ft don toliver ,0
vYexezLbQDE,monster inside  official trailer  hulu ,0
EPBcMH4USIA,t mu bc tranh bc s eo ng nghe ,0
_3IfL9hIM2o,nora fatehi all party songsnora fatehi all song mp3nora fatehi all song audionorafatehi playlist ,0
qqSmrQWui3M,how to cheat in world of tanks ,0
BddP6PYo2gs,kesariya  brahmstra  ranbir kapoor  alia bhatt  pritam  arijit singh  amitabh bhattacharya ,0
87JIOAX3njM,what jhumka  rocky aur rani kii prem kahaani  ranveer  alia  pritam  amitabh  arijit  jonita ,0
K7LYgTX2o38,another final another upset first time worlds finalist wins thrilling men39s 400m  nbc sports ,0
rq9ZEepG3Mo,top 100 most viewed songs on youtube ,0
RlPNh_PBZb4,olivia rodrigo  vampire official video ,0
YeLRZL7_VYI,ist red dead redemption heute noch ein meisterwerk ,0
ytQ5CYE1VZw,eminem  till i collapse hd ,0
VCEdM99AzCE,why ryder39s betrayal doesn39t make sense  gta san andreas lore analysis ,0
ztWuAKte8nk,6m59 canyon dogfight  top gun maverick ,0
GDLVhU_Dqys,pov volleyball hitters  volleyballlife volleyball athlete sports ,0
QWne4GeXOeI,the transformers the movie 1986 ,0
6gU5CyZ7wiI,top gun maverick beach scene 4k imax ,0
8lR2r2T53s4,star wars projects we actually need part 1 ,0
5lh7xCSqdAU,wargaming killed top of the tree in world of tanks ,0
9skA3PGqTnk,greatest choked by pakistan  youtubeshorts ytshorts shorts ,0
7O0vUI2xAPk,understanding the brilliance of ymir amp eren39s chase  overanalyzing attack on titan amp retrospective ,0
YHH4giJHWB8,agora hills ,0
q5H4IiTzYqg,why taylor swift should be canceled ,0
MCbysTew9EI,list of mcu phase 1 to phase 6 all movies by release date 20082026 ,0
ehMHnR7yMhw,most honest advice for building muscle as a natural ,0
HFRCLR6pz_c,rebuilding dodge charger srt hellcat 990hp  forza horizon 5  thrustmaster t300rs  th8a shifter ,0
4dhgz8rtnm4,the honest truth of how to rank up in rocket league ,0
Rd9LGGTj_to,best of nora fatehi 2023  jukebox non stop  top hindi bollywood hit songs  music hitbox ,0
qBg60rSfiHY,nba 2k24  le jour o michael jordan s39est dguis en jaylen brown  ,0
2iTzC6gbdpI,championship shootout drama coach nasher finale ,0
oYUdBUPAqhU,top 40 songs this week 2023  playlist music hits 2023 ,0
1g2aAkydT2Q,top 15 best new games of 2023 ,0
RorM4kRjguA,the most powerful gaming laptop ever  msi titan gt77hx  ad ,0
FSCiAkRbdug,sheldon gets kicked out of a casino  the big bang theory ,0
XIQR2-iLMkU,a night to remember ,0
wDSgTjC9oLI,pubg is better than ever ,0
RlPNh_PBZb4,olivia rodrigo  vampire official video ,0
ukrkkdYsUvU,best 600 gaming pc build guide  step by step  how to upgrade ,0
bp6uYrxM-6Y,how much should you spend on a gaming laptop  ,0
D2iA-hW2eeM,billboard hot 100 songs of 2023  miley cyrus ed sheeran maroon 5 shawn mendes justin bieber ,0
x_GW12BfwLk,spiderman 2 full game gameplay walkthrough 2023 ps5 4k 60fps no commentary ,0
GrKQvyXpNgc,taylor swift  cruel summer music video ,0
vNm3VPPKEQI,totally killer  official red band trailer  prime video ,0
SAGSsUJkIfo,top 15 best movies on netflix to watch now 2023 ,0
jfhVRA99MbI,logitech g cloud the portable gaming console ,0
tV4hy35LcFE,how to create crunchyroll account  sign up  register to crunchyroll ,0
krLVtmA_3JE,billie jean challenge beatbox beatboxchallenge ,0
6W8Mw3itnr8, demonio hurfano sin magia se convierte en el mago ms poderoso 13  black clover  resumen ,0
W-Y-vlwm8ok,the eras tour traditions swifties taylorswift theerastour edit new songs tour 1989 fans ,0
ZzkHA7iMosM,bulgarian weightlifters unleash in the training hall  worlds 2023 4k ,0
XAYhNHhxN0A,mission impossible theme full theme ,0
wRnSqqRXKNQ,arijit singh mashup  slowed amp reverb  lofi song nonstop arijit singh  15 min mindrelax lofi ,0
cM4q33O2Qys,ross finds a new apartment for rachel clip  friends  tbs ,0
63bhU78wOeQ,rocket league smartest 200iq plays of all time 5 best fakes and mindgames ,0
V0Ev0rbO1jo,bollywood new year party mix 2023  nonstop hindi punjabi songs amp remixes 2023 ,0
JDeFBbZ5OAY,womens football ,0
gRpDma9vlx4,pov you39re a mob in minecraft ,0
sqigSJF3Pe4,lebron laughs while gilbert arenas once again trashes the michael jordan era ,0
DnEZg34tR5M,khaid  anabella official music video ,0
x1SecGez6as,top 50 smartest league of legends clips of 2023 ,0
n7rE-Wlo5wg,rundown spaz  first day out freestyle official music video ,0
Cm-mmiLosBw,jordan vs magic coldest moment  ,0
2Hgu1TX9mi4,i did a musty flick with every car in rocket league rocketleague ,0
bQAmxwO2bKc,chesscom reacts to hilarious support emails ,0
SalQne7m0UE,the cheapest rtx 4080 gaming laptop msi gp68 review ,0
SaiT1PVnYAc,lionelmessi ronaldo sportsnews viral youtubeshorts video ytshorts ytshort shorts short ,0
dDI4tuu0skw,top 10 best mobile games of 2023 so far ,0
SaKruW6L62Q,why arent more people good at calisthenics ,0
LK6_f5I33R8,goblin slayer ii  opening  entertainment ,0
gl53pG9-AOc,danny garcia usa vs jose benavidez jr usa  boxing fight highlights hd ,0
6asLp92fzz4,thor 5 legend of hercules  teaser trailer  marvel studios ,0
Pyo1AUo1Ysk,full day of eating during a lean bulk  joshua manoi  3732 calories ,0
NdlnKPDPp6o,demon slayer staffel 3 in 33 minuten ,0
WyqeTJJAY5E,lego titanic  stop motion film ,0
EtjQVqXUPHo,attack on titan final season  opening 2  the rumbling ,0
gGMgjjRdO88,hindi party songs 2019 bollywood new hindi party songs audio jukebox 2019 ,0
7qlJ14xruho,all time exp record world of tanks ,0
yA9kQ7o4J_o,is the maus epic f2p world of tanks ,0
LK-aIrq8mYA,how to lose friends in minecraft ,0
fPajXNnNGvY,kohli funny moments  ,0
ehip4XUEiA0,stunning effort from danielle ponter in the aflw blockbuster against the lionsafl aflw highlights ,0
mvCWGL_r-Zg,badshah  gone girl    official music video  payal dev  sakshi vaidya ,0
vPhXXbn12tg,the funniest sitcom britcom ever produced quotwaiting for godquot ,0
D04ni_5evhU,ms dhoni 009 sec stumping world record  shorts mahi cricket ,0
B_UvdLYSk7Q,what is imax ,0
lhu64jQ-91s,goat magnus is back ,0
iUiaxLleLcE, live powerlifting world classic open championships  men39s 120kg group b ,0
hVsz24jPl4c,shadow vs vegeta  cartoon beatbox battles ,0
Xzv84ZdtlE0,why oppenheimer deserves his own movie ,0
smPvoNUk7j8,virat kohli shows off  ,0
yAFHeSAFq6o,netflix and bill streaming giant announce increased prices ,0
fLFvbwrWLQY,ariana grande  pov official live performance  vevo ,0
Rif-RTvmmss,the weeknd  starboy audio ft daft punk ,0
k0L7dtt1D5s,iron man vs spider man new home spider man no way home spider man miles morales funny animation  ,0
XONaolakZeA,iphone 15 pro the ultimate gaming phone ,0
PtWAOuHCDy4,edson barboza vs shane burgos  free fight  ufc vegas 81 ,0
CpFL1Ib77hE,avatar frontiers of pandora  official game overview trailer  ps5 games ,0
wJYMATpNDhU,omg mission impossible ,0
uhxF0tSf_aA,5 things to know before you sign up for hulu live  hulu  live tv review ,0
nFWQAyiqXvY,netflix39s disaster squid game reality show ,0
CXh3NwucNWs,day 9  morning session  paris 23 para athletics world championships ,0
7rDeTPxIz-Q,friends  best moments from season 2 ,0
qoytj8mNq7s,livenow from fox ,0
HSZs5Tfzh78,10 hours of kassadin made me hate early game ,0
2Bj_Kg74Vps,smartest moments in league of legends 13 ,0
6OLVFa8YRfM,the insane logistics of formula 1 ,0
M4K0s792wAU,how to build muscle and lose fat at the same time step by step explained body recomposition ,0
VAlANIn2CIg,top guitar covers of popular songs 2022  best instrumental music for work study sleep ,0
ATJqXLcksbg,hindibodoadivasinepaliassamese traditional mashup 2  omprakashbabysuman ft khushbu giri  kmb ,0
DNmc-p8GEo8,top 3 multiplayer game39s  shorts yashgamerz69 ,0
zUCU5aLbwuQ,top 10 impossible catches in cricket history ever ,0
koeP8-fLCUg,top 10 strongest characters in attack on titan ,0
QJWDOU1NxCs,titanic bts jack dawson  rose dawson  shorts yt ,0
E2payjgyzw0,transformers full movie 2023 robotic beasts  superhero fxl action movies 2023 english game movie ,0
t8y05l9nMRI,ironman in endgame ironman edit  shorts ironman avengers marvel ,0
4gDsynyEvSI,indian free fire esports teamsfree fire shortsfreefire shorts trending gaming esports short ,0
4nvpSeMz9nE,mission impossible 7 dead reckoning part 1  full airport scene with tom cruise ,0
mCpTHLC4EO4,gta 5 but everything i touch is mine ,0
raice2C6M_0,byahe mashup   neil enriquez x pipah pancho nonstop mashup 2023 ,0
isIvj3e2t6A,lamborghini sin roadster  forza horizon 5  thrustmaster tx ,0
tcYodQoapMg,ariana grande  positions official video ,0
V0m8CQMOqxc,fsx  the best flight simulator ever ,0
9vpH-aVwF_8,miles39 new suit is crazy marvel39s spiderman 2 ps5 part 2 ,0
0QJ4Cc_yA7w, fra vs  usa  full match  final 12  men39s vnl 2022 ,0
Fuaf4MjtiCo,original vs remake 2 bollywood songs ,0
ZoO8eXV1h_Q,forehand level 100  shorts ,0
nfWlot6h_JM,taylor swift  shake it off ,0
K3CzfTJ0vWA,cypher  official trailer  hulu ,0
y4ID37i0UDI,snoep of je leven in minecraft ,0
4k7FOjEENh4,upgrading smallest to biggest ramp cars in gta 5 ,0
qYwlqx-JLok,messi en olga con migue granados la nota completa en miami ,0
2Jy4dX3zefM,reacciono a heartsteel  paranoia league of legends  shauntrack ,0
SpD9Wz2txi8,top 21 best sitcoms of every year 20002020 ,0
YZlUBmwTwFo,messi cant be human  ,0
r0menZrzyTI,daku  ms dhoni  daku edit  daku song edit  the legend ms dhoni  attitude status ,0
CakPu2hFu6c,     virat kohli vs bangladesh malayalam cricket wc 2023 ,0
E6pXemDtzsc,16  epic herobrine   shorts minecraft ,0
q1XTgjtc5xw,dealing with all the pain  ,0
CwMncLe8AqE,is aether gay genshinimpact ,0
W4VTq0sa9yg,gta san andreas theme song full   ,0
diW6jXhLE0E,the weeknd  party monster official video ,0
NDKRtjCEvVA,the mandalorian full movie 2023 star wars  superhero fxl action movies 2023 english game movie ,0
1OnCCp18-1k,dream big  the solido imax camera ,0
uUizdi-YNuw,i tried every cloud gaming in 2023 ,0
LH4Y1ZUUx2g,ariana grande  break up with your girlfriend i39m bored official video ,0
GmtTDvNcXcU,despacito piano cover  peter bence ,0
vE9tnJwhhSY,football numbers with deeper meaning  ,0
LKrcDYvwV1Q,the conjuring 2 2016  the crooked man scene 210  movieclips ,0
sIiUwbBxZo8,goosebumps  official trailer  disney and hulu ,0
fS9C8rFjsLs,the best of piano chopin beethoven debussy satie classical music for studying and relaxation ,0
GNZBSZD16cY,beatbox brilliance  tom thum  tedxsydney ,0
vqlu1DUtg8A,with ease  ,0
14-HuDAa7vM,basket case  green day  drum cover ,0
imNWaHtGwnw,building muscle vs building strength  what39s the difference ,0
IeykV4yFlrE,the conjuring  hide amp clap  warner bros entertainment ,0
iLel29pZ314,the strongest snatch battle ever  220kg snatches ,0
kocYRZVUzdw,3 minute patch 1321 guide  a guide for league of legends ,0
ym9MpAz5PNI,juice wrld  sometimes official visualizer ,0
mVupXkSH4sQ,king kohli39s 199run series blitz  from the vault ,0
sxjC4CNG3_c,logic  black spiderman ft damian lemar hudson official video ,0
dtMq9F07_N4,anime vs raddit the rock reaction meme anime animevsraddit ,0
UwVQh6iOP0Q,    real racing 3 ,0
LZjH0ogGKfc,vermelho branco e sangue azul  cena deletada  prime video ,0
Kwqxm-Ka2vQ,gta san andreas neden en y gta oyunu ,0
NWUccqZo3Hg,dramatic classical music ,0
QiDi3PzGC2Y,are the paralympics ableist ,0
025u8ZzilDI,top 3 games like gta 5 for android  top 3 games like gta 5 shorts ,0
QVGgJqJo50w,two and a half men  the best of berta ,0
VzEqqSUWNjw,post malone  austin official live performances  vevo ,0
yrcqu0yQuds,unsolved mystery in the witcher 3 ,0
VronettmNRI,ariana grande  positions album official live performances  vevo ,0
mik6yI0SSpw,black screen 10 hours  crickets and frogs  summer night sounds  cricket sounds  frog sounds  v4 ,0
_q8s93klams,sultans of swing dire straits drum cover by sina ,0
D0QCtgSxVfA,movies39 mistakes that you didn39t notice hunteronamazonminitv ,0
wbQHZDhzaAk,how to use cloud gaming on your xbox ,0
E_d0uO-ahKY,a experincia do cinema ft cris minegirl roblox the cinema experience ,0
1-l29HlKkXU,the witcher 3 wild hunt  launch cinematic ,0
uq59m1Ni50w,finally bought a new lamborghini essenza expensive ,0
fJrnOiBaVfo,xbox cloud gaming revisited late 2022 ready yet ,0
eErSmQLzmfw,yonex french open 2023  tangtse hkg vs fenghuang chn 3  r32 ,0
aXxrBKOSba4,8 hours classical music for sleeping  chopin debussy satie ,0
lSOU2PafOtg,top hits 2023  best pop music playlist 2023  billboard hot 100 this week  best english songs 2023 ,0
40tQ_X1Px7Y,god of sport  heroics knockouts comebacks game winners amp more ,0
argpSxB1NQE,the entire history of video games ,0
GO4owuDruFM,how to pick a gaming laptop  avoid these mistakes ,0
ow219idh6LU,mission impossible  dead reckoning part one  rome world premiere red carpet show  tom cruise ,0
93XIFYJp4JA,anushka sharma takes a hilarious dig at virat kohli39s celebration his epic comeback goes viral ,0
AAHnmn1_RD0,top 5 marvel movies ranked ,0
zSRvmHSgaBg,titanic  quotwon39t let goquot clip  paramount movies ,0
Pswx6OQp1Ks,destroyer of worlds ,0
jLLG6aNLwys,a spectacular ace by ricardo lucarelli  epicvolleyball volleyballworld volleyball ,0
owML9jpqyyo,rivaldymentari ina vs puavaranukrohtaerattanachai tha  r32  french open 2023 badminton ,0
T6xf4ODHX9Y,evolved cards vs epic cards  clash royale challenge ,0
tK2gVp3tKMs,the batman  club fight scene batman meets penguin  movie clip 4k ,0
3Ykvzmz4q-M,billboard hot 50 top singles this week 2023  miley cyrus  ed sheeran  justin bieber  harry style ,0
yBZPhi47rUs,water challenge beatbox tiktok ,0
OCunD832WnU,ft iron man x brown rang attitude status shorts youtubeshorts trendingshorts ironman ,0
NjEht4lU0AE,why obiwan said the clone wars made the jedi quotfalse jediquot  star wars explained ,0
221F55VPp2M,friends joey39s bad birthday gift season 4 clip  tbs ,0
PIcOtwBWYO0,tokyo 202039s funniest moments   tokyo 2020 paralympic games ,0
YvGsfHKLnpQ,spiderman 2 just confirmed its final update shorts ,0
0PkKXkEIMdc,top 100 most viewed rock songs on youtube ,0
s9uj17r9pVQ,ram pa pa pam ,0
zlpfcKffgDA,disguise  short horror film ,0
qAWEb0h43lU,oppenheimer  official trailer ,0
qP-fGNA6ujM, por isso que voc parou de ir ao cinema ,0
j5-yKhDd64s,eminem  not afraid ,0
MTWM57qvmEM,ronaldo vs lewandowski vs ramos  pushup with kids ,0
sYtO15zgfXI,quotdouble pay day get up   tyson fury calls for usyk fight on december 23 ,0
zMdh_Ji5uJE,trying spells from hogwarts legacy on a real wand ,0
r7nAoo65zEY,what if upper moons were the demon king instead of muzan kokushibo doma akaza ,0
C82FG6Qow_U,liwa 2022 hill climb racing ,0
9vXImLv414Y,top 10 best rpgs on ps5 ,0
bKpnFKUTIGc,slipknot  psychosocial  drum cover by kristina rybalchenko ,0
M0j562L5Du0,10 more genius ways video games fought cheaters ,0
W7F0u-O9oIA,top best english songs 2023  pop music 2023  billboard hot 100 this week  new popular songs 2023 ,0
LHq6F3UsDDI,marvel studios the marvels  hindi teaser trailer ,0
HOpuR8taAuo,no no no no no no no no no no ,0
7lrHn_kDkyE,marvel movies from 1944 to 2025  movie lister  ,0
lpTeqJxJHwM,50 insane amazon prime day 2 deals 2023 ,0
h1crnRYdSnQ,i survived 100 days as iron man in minecraft ,0
x07j6Vz3uOg,pubg ayud a free fire  historia  johaanzu ,0
RM6bnOmLgyM,we made the perfect rocket league car ,0
30TxwRXWa1s,most popular songs of 2010 to 2023 ,0
zj4SxFhHz_A,i wish i knew these essential tips earlier  hogwarts legacy  tips amp tricks guide ,0
Un7Wj9C6E8Q,best of arijit singh mashup 2023  arijt singh jukebox  best of 2023  bollywood lofi  music lover ,0
iSsSWy8xxFs,quiz lady  sisters on set  hulu ,0
jT4jMrjbspQ,top 10 mobile games of 2023 new games revealed android and ios ,0
-2vE-hFCpLc,feeling cynical about barbie ,0
_qTZRD1_ybQ,titanic  quotyou jump i jumpquot clip  paramount movies ,0
eXWgavcqRR0,full match  ma long vs felix lebrun  ms sf  wttlanzhou 2023 ,0
2LzhGOYdrf0,mission impossible  dead reckoning part one  exclusive featurette  rome ,0
7RcRZZrL13k,the best olympic weightlifting program ft zack telander ,0
jnyRxjVUDVY,top 15 best mobile games of 2023  best android games 2023 offline  online ,0
W7F0u-O9oIA,top best english songs 2023  pop music 2023  billboard hot 100 this week  new popular songs 2023 ,0
stjp3h38HCM,the top 10 greatest plays in esports history ,0
SOX2GDuAnww,top 50 new pc games of 2023 4k ,0
T-eo_s0LVxo,choose the right nvidia rtx gpu for your gaming laptop ,0
zekch0_z_IM,how to connect a wireless xbox one controller to your console ,0
JBm7FwQ_MCQ,the kid laroi jung kook amp central cee just made a hit rapper analysis ,0
XdQQOeTZrUM,top 10 fastest cars in forza horizon 5  steering wheel gameplay ,0
x9NmvcRtLyM,wtf attack on titan 2x6 quotwarriorquot reaction ,0
Vkr60pRLIbI,top violin covers of popular songs 2022  best instrumental violin covers songs all time ,0
oIhCyPaDP6g,beyond imax filming with a gigantic 16k sensor with sample  epic episode 10 ,0
VB6SIKl8Md0,classical piano music by mozart  relaxing piano sonata for concentration  best study music ,0
_tZueCsquUY,this move was tuffedit shorts basketball highschool ,0
8S-mxrO0bzk,build muscle at home with no equipment part 2 ,0
ntz2c2z54dg,the downfall of mobile gaming ,0
8I-cXVFaMtA,the halloween boss challenge ,0
0_43qcWlXvA,alan is a creep and gets a wedgie  two and a half men ,0
MjfXKL2f2Ek,wait for indian bowling  shorts cricket cricketshorts ipl ipl2023 viratkohli teamindia ,0
Rm8zWR42RC0,day 5  morning session  paris 23 para athletics world championships ,0
xWwRpX3cfX0,how to program your calisthenics training for the fastest growth ,0
7kktyWWgX5w,lionel messi showing why he won the 8th ballon d39or ,0
4G3bcLDpykM,dimitrij ovtcharov vs zhou qihao  ms r16  wtt star contender lanzhou 2023 ,0
i4u9WOASvaM,marvels spiderman 2 director answers video game questions from twitter  tech support  wired ,0
i7mzk_mE0oA,qu es vevo  shorts ,0
2avPJ9TZNmU,juice wrld amp the weeknd  smile official video ,0
XnZX0HkxRbg,the most memorable paralympic moments over the years  paralympic games ,0
CVImrl8IKBM,landing on the hudson river like sully  microsoft flight simulator ,0
yLFrgCW9yBI,best movie soundtracks ever made compilation part 3 ,0
s37x2VSZrLw,the weeknd amp ariana grande  save your tears live on the 2021 iheart radio music awards ,0
eaDqJohZM_A,if titanic was in 2022  shorts ,0
E5ONTXHS2mM,desiigner  panda official music video ,0
XtQxdsVdkb4,transformers the last knight  directors cut movie clip  hot rod 2021 ,0
NkkdV32SRHY,gta san andreas secrets and facts 45 how to get swat tank bikes tuning beta features ,0
JCzCILQMyD4,michael jordan on the goat debate  shorts ,0
8kXWYfzThQc,let39s play free fire in samsung mini  ytshorts ,0
wbAmRKj877A,speed finds out virat kohli met ronaldo ronaldo virat speed ,0
8dJbQRG5U5g,bollywood old hindi love romantic songs  90s evergreen melodies all hits  ,0
g3b5zV1X3Y0,top 10 times penny was the smartest character on the big bang theory ,0
ePpJDKfRAyM,marvel studios39 avengers endgame ,0
pDCKV8CSKuY,logic  juice ii official music video ,0
_qQsPw4CqUI,marshmello amp logic  everyday audio ,0
JuarnKU1eKw,top trending songs 2022 video jukebox  manike  kusu kusu  srivalli  hit songs 2022 ,0
XzOvgu3GPwY,taylor swift ft ice spice  karma official music video ,0
fZGpYKAdkoM,upper moon meeting demon slayer vr ,0
4VdAParM4h8,may december  official trailer  netflix ,0
cOjYAFS24gc,alternative rock of the 90s 2000s  linkin park creed audioslave hinder evanescence ,0
DBj603jm-X4,when you buy a bunch of new games but never play them ,0
T1xu3Rv9JKw,we tested 1 star vs 5 star reviewed gaming pcs to play fortnite ,0
mwKHEvkdjl0,pov coming out as emo to your parents  emo gothic alternative rock rockmusic hardrock ,0
b9frx9WWVf8,october jazz  cozy autumn bossa nova amp smooth jazz instrumental music for positive mood ,0
IodCaoo-Pms,10 facts that messi and ronaldo fans need ro accept ,0
bGX3lSoGpvU,worlds highlights all games 2023 day 4 round 3 ,0
kmuMyXgTEWg,the reason cbum wants to quit bodybuilding  ,0
6Y3zYsLfFGw,michael jackson  beat it  electric guitar cover by kfir ochaion  spark ,0
uB8cPQiNDok,i hear the drums of liberation  one piece ,0
ZXotewPcjCQ,beggin39  mneskin drum cover ,0
xUs5Q135b6Q,luis fonsi  buenos aires official video ,0
qcGMKd8iego,barbie  official trailer 2023 margot robbie ryan gosling will ferrell ,0
K3B8-klo5xc,kesariya dance mix  brahmstra  amitabh b  ranbir  alia  pritam  shashwat  antara ,0
